topic_id,label,size,top_words,coherence,representative_snippets,subreddit
5,Cannabis Don,108,"['cannabis', 'don', 'weed', 'use', 'alcohol', 'marijuana', 'effects', 'cause', 'feel', 'smoke']",0.38641277991748074,"['found study that contradicts the one from last week about flow mediated dilation being lower amongst cannabis users. just wanted to share. this one showed minimal differences between users and non use...', ""fatal traffic crashes linked to marijuana fell by % in ohio last year as legalization took effect, contrary to opponents' fears - marijuana moment"", 'cbd products are associated with runners reporting less anxiety and perceived exertion according to the results of new study']",cannabis
3,Political Landscape,96,"['marijuana', 'trump', 'cannabis', 'biden', 'don', 'legalization', 'president', 'state', 'actually', 'states']",0.5615120009869808,"[""with cannabis legalization & women' rights under threat, wnba star & three-time olympic gold medalist brittney griner featured at women grow leadership summit"", 'new florida marijuana initiative faces ‘big time trouble’ in supreme court, desantis says, predicting it’ll be blocked from ballot', 'bill maher insists he ‘wasn’ high’ when he had dinner with trump at the white house, calling it ‘missed opportunity’']",cannabis
2,Legalization Movement,66,"['dea', 'weed', 'legal', 'cannabis', 'money', 'marijuana', 'war', 'don', 'let', 'medical']",0.40405870839173924,"['dea marijuana scam: as dea cannabis program implodes this /, mmj stands alone in pursuit of real medicine | financialcontent', 'dea declines to say where it stands on marijuana rescheduling in new legal filing reacting to claims it conspired with opponents', ""florida’ surgeon general offers ‘spiritual' concerns over recreational marijuana | “drugs diminish our ability to be all that we can be, to be representations of god' love, god' light, god' wisdom, go...""]",cannabis
4,Legalization Movement: Cannabis,63,"['cannabis', 'grow', 'thc', 'legal', 'plant', 'market', 'experience', 'weed', 'started', 'dispensaries']",0.7206412634292458,"['consumers weighed in on their weed shopping experience, revealing more about why they may avoid the dispensary. tldr: third of those polled find shopping at licensed retailers overwhelming', 'toxic cannabis grown by organized crime is legally being shopped to maine dispensaries, officials confirm, with little to stop it from reaching consumers', 'the real life story of how former lawmaker grew weed and provided legal cover for alleged chinese criminal groups in rural maine']",cannabis
1,Financial Health,49,"['marijuana', 'weed', 'cannabis', 'government', 'money', 'drug', 'say', 'way', 'yeah', 'medical']",0.15922046508361154,"['california senators approve bill to legalize marijuana cafes where people could smoke, eat food and watch events such as concerts - marijuana moment', 'it’ time to legalize medical marijuana in indiana, incoming governor says as new poll shows nearly in hoosiers agree', ""new congressional cannabis leaders take up push for reform in (newsletter: january , ) feds' psas embrace marijuana culture; fda' cbd tampon warning; nj & ca cannabis consumption lounges; ky medical m...""]",cannabis
0,State Politics,20,"['texas', 'stop', 'better', 'plant', 'pay', 'anxiety', 'thc', 'pissing', 'cannabis right', 'maybe']",1.2763169273201431,"['both sb and hb in texas house have been ""left pending in committee"". these bills are both likely dead. weed is still legal over the counter for the next two years!', 'they made maga cannabis subreddit right before the election and people were pretty loudly arguing that trump would legalized cannabis. then right after he won the election, the subreddit turned into g...', 'this is interesting because there is hb that is up for vote that allows recreational use of cannabis that was filed on // which was before sb was filed believe. also believe they filed this in respons...']",cannabis
